id,title,vote_average,vote_count,status,release_date,revenue,runtime,adult,backdrop_path,budget,homepage,imdb_id,original_language,original_title,overview,popularity,poster_path,tagline,genres,production_companies,production_countries,spoken_languages,keywords,data
429829,Meatball Machine Kodoku,6.333,21,Released,2017-08-19,0,100,False,/lY5HvPXAJLHY4k7I92zfH7JE5fO.jpg,0,,tt6063024,ja,蠱毒 ミートボールマシン,"Nobody knows where they came from. They parasitize in human beings, take control of them and change their bodies into hideous monsters (Necro-borg). The Necro-borg fight each other until the other dies. Where did they come from? To what end? Yuji and Kaoru, whom both have dark secrets within themselves, get caught up in the horrific battles of Necro-borg. What will their fate be?",4.687,/3UO2ISt7v1RaZ7lBjki0c6IVjkd.jpg,,"horror, science fiction, action, comedy","Ark Entertainment, Nishimura Motion Picture Model Makers Group, King Records",Japan,Japanese,,"Titulo: Meatball Machine Kodoku, Estado: Released, Sinopsis: Nobody knows where they came from. They parasitize in human beings, take control of them and change their bodies into hideous monsters (Necro-borg). The Necro-borg fight each other until the other dies. Where did they come from? To what end? Yuji and Kaoru, whom both have dark secrets within themselves, get caught up in the horrific battles of Necro-borg. What will their fate be?, Generos: horror, science fiction, action, comedy, Empresas_productoras: Ark Entertainment, Nishimura Motion Picture Model Makers Group, King Records, Idiomas_hablados: Japanese, palabras_clave: nan"
36737,Carny,5.024,21,Released,2009-04-24,0,88,False,/3DnR786TXSqt3Zzt5XIrcBj4jOq.jpg,0,,tt1397497,en,Carny,"When a traveling carnival comes to a rural Nebraska town, the caged attraction everyone is talking about is the alleged Jersey Devil. When the beast escapes, tearing the citizens to shreds, local sheriff Sam Atlas steps up to form a tracking team. But the carnivorous fugitive is only one of Sam’s problems. The local pastor, enraged by the death of his son at the hands of the beast, has plans for igniting his own brand of hellfire and revenge.",3.521,/kU7HIn9ejT6rjotj0IAUOaCh6j9.jpg,The carnival is anything but fun.,"horror, science fiction, tv movie, action, fantasy","RHI Entertainment, Muse Entertainment","Canada, United States of America",English,,"Titulo: Carny, Estado: Released, Sinopsis: When a traveling carnival comes to a rural Nebraska town, the caged attraction everyone is talking about is the alleged Jersey Devil. When the beast escapes, tearing the citizens to shreds, local sheriff Sam Atlas steps up to form a tracking team. But the carnivorous fugitive is only one of Sam’s problems. The local pastor, enraged by the death of his son at the hands of the beast, has plans for igniting his own brand of hellfire and revenge., Generos: horror, science fiction, tv movie, action, fantasy, Empresas_productoras: RHI Entertainment, Muse Entertainment, Idiomas_hablados: English, palabras_clave: nan"
347064,Jurassic Prey,3.333,21,Released,2015-06-23,0,87,False,/3FvTZR548z8R93PepaDy8MMuxhK.jpg,0,,tt3469284,en,Jurassic Prey,"A woman steals money from her mob boss husband hoping to start a new life with her lover. Meanwhile, a washed-up former child star and his buddies rob a bank with a police detective hot on their trail. Through a twist of fate, these people all find themselves at a remote cabin, unaware that recent construction work has unleashed a ferocious creature which now roams the surrounding area! Who will survive in MEATEATERS!",2.201,/xhVuhDc4RTmV0AcfTaNfLtvCWyp.jpg,Prepare for extinction,"science fiction, action, horror",Polonia Brothers Entertainment,United States of America,German,,"Titulo: Jurassic Prey, Estado: Released, Sinopsis: A woman steals money from her mob boss husband hoping to start a new life with her lover. Meanwhile, a washed-up former child star and his buddies rob a bank with a police detective hot on their trail. Through a twist of fate, these people all find themselves at a remote cabin, unaware that recent construction work has unleashed a ferocious creature which now roams the surrounding area! Who will survive in MEATEATERS!, Generos: science fiction, action, horror, Empresas_productoras: Polonia Brothers Entertainment, Idiomas_hablados: German, palabras_clave: nan"
29792,Fire Serpent,4.2,20,Released,2007-02-24,0,89,False,/d0S4tAqHKAUvUVlK3dTo31Ehg5W.jpg,2000000,,tt0471561,en,Fire Serpent,Alien creatures emerge from the sun and attack Earth.,4.276,/2sC7Pm9xBkPWaNZkHJ1Ruetskfe.jpg,The Inferno is Upon us.,"tv movie, horror, science fiction, action","CineTel Films, Kandu Entertainment, Outrage Productions 7, Premiere Bobine, S.V. Scary Films 4","Canada, United States of America",English,"alien life-form, solar flare, monster movie","Titulo: Fire Serpent, Estado: Released, Sinopsis: Alien creatures emerge from the sun and attack Earth., Generos: tv movie, horror, science fiction, action, Empresas_productoras: CineTel Films, Kandu Entertainment, Outrage Productions 7, Premiere Bobine, S.V. Scary Films 4, Idiomas_hablados: English, palabras_clave: alien life-form, solar flare, monster movie"
26144,Samurai Princess,4.375,20,Released,2009-05-28,0,82,False,/jVIQTt98frMAo77HnrfQ6wG6xwr.jpg,0,http://www.samurai-princess.com/,tt1412334,ja,サムライプリンセス 外道姫,"When 11 of her friends are raped and murdered, leaving the Samurai Princess (Aino Kishi) the only survivor, she becomes infused with her comrades' souls. Transformed into an android, she sets out to avenge their deaths. Dai Mizuno co-stars as the princess's human partner in this Kengo Kaji-directed gore fest that features breast grenades, detachable chainsaw limbs, deadly guitar riffs and more.",5.085,/2SnfWeWweozPtJCIqMMSm6UgEvA.jpg,A new samurai is born.,"action, horror, science fiction",,Japan,Japanese,"cyborg, resurrection, female protagonist, chanbara","Titulo: Samurai Princess, Estado: Released, Sinopsis: When 11 of her friends are raped and murdered, leaving the Samurai Princess (Aino Kishi) the only survivor, she becomes infused with her comrades' souls. Transformed into an android, she sets out to avenge their deaths. Dai Mizuno co-stars as the princess's human partner in this Kengo Kaji-directed gore fest that features breast grenades, detachable chainsaw limbs, deadly guitar riffs and more., Generos: action, horror, science fiction, Empresas_productoras: nan, Idiomas_hablados: Japanese, palabras_clave: cyborg, resurrection, female protagonist, chanbara"
31154,Steel and Lace,5.0,20,Released,1991-01-30,0,90,False,/usYUwfhSAX3M9I8TRZ64WeDgX4G.jpg,0,,tt0100688,en,Steel and Lace,"Daniel Emerson is acquited of the rape of classical pianist Gaily Morton, and part of the blame for the acquittal lies with the testimony of Daniel's friends Norman, Oscar, Toby, and Craig, who all helped Daniel rape Gaily. Still devastated by the rape and unable to deal with the acquittal, Gaily commits suicide by jumping off of the top of the court building as soon as the trial ends, much to the horror of her brother Albert, who is a scientist. Five years later, Daniel has made Norman, Oscar, Toby, and Craig partners in his business, which forces homeowners and their homes out of the way to make way for bigger developments. By this time, after five years of working with Gaily's body, Albert has turned Gaily into a cyborg that is programmed to get bloody revenge on Daniel, Norman, Oscar, Toby, and Craig.",3.914,/ozdNT5i6QHpKE5doje68imkcEEu.jpg,She's tough. She's tender. She's all woman. And all machine.,"action, horror, science fiction",Cinema Home Video Productions,United States of America,English,"rape, cyborg, exploitation, revenge, rape and revenge","Titulo: Steel and Lace, Estado: Released, Sinopsis: Daniel Emerson is acquited of the rape of classical pianist Gaily Morton, and part of the blame for the acquittal lies with the testimony of Daniel's friends Norman, Oscar, Toby, and Craig, who all helped Daniel rape Gaily. Still devastated by the rape and unable to deal with the acquittal, Gaily commits suicide by jumping off of the top of the court building as soon as the trial ends, much to the horror of her brother Albert, who is a scientist. Five years later, Daniel has made Norman, Oscar, Toby, and Craig partners in his business, which forces homeowners and their homes out of the way to make way for bigger developments. By this time, after five years of working with Gaily's body, Albert has turned Gaily into a cyborg that is programmed to get bloody revenge on Daniel, Norman, Oscar, Toby, and Craig., Generos: action, horror, science fiction, Empresas_productoras: Cinema Home Video Productions, Idiomas_hablados: English, palabras_clave: rape, cyborg, exploitation, revenge, rape and revenge"
92766,Underworld,3.5,20,Released,1985-11-29,0,103,False,/7rnACeu0KFMRsT2TeEYZXoOBa62.jpg,0,,tt0090233,en,Underworld,"When high class hooker Nicole is kidnapped from her brothel, Rich businessman Hugo Motherskille hires her ex love Roy Bain to find her. Investigating the disappearance, he eventually finds traces that lead to Dr. Savary, who has produced a strange white powder that's coveted by a race of deformed human beings who live in the underworld in the sewers below the city.",3.223,/nXx5ByHcqqArMKsPSwCSFCE7shb.jpg,A horrible experiment. A criminal empire. One thing in common...,"horror, science fiction, action","Limehouse Productions, Green Man Productions, Alpine",United Kingdom,English,"rescue, brothel, gang, physical deformity","Titulo: Underworld, Estado: Released, Sinopsis: When high class hooker Nicole is kidnapped from her brothel, Rich businessman Hugo Motherskille hires her ex love Roy Bain to find her. Investigating the disappearance, he eventually finds traces that lead to Dr. Savary, who has produced a strange white powder that's coveted by a race of deformed human beings who live in the underworld in the sewers below the city., Generos: horror, science fiction, action, Empresas_productoras: Limehouse Productions, Green Man Productions, Alpine, Idiomas_hablados: English, palabras_clave: rescue, brothel, gang, physical deformity"
126962,Infected,3.7,19,Released,2013-04-09,0,95,False,,2100000,,tt1622991,en,Infected,A blood virus infects a small group of hunters turning a father & son trip into a fight for survival.,2.164,/f8wPeIHyY0OARlRIhcvT0CyEcxI.jpg,Prepare for a Zombie Evolution,"horror, action, science fiction",Woodhaven Production Company,United States of America,English,"dystopia, infection, rhode island, survival, lyme disease, zombie apocalypse","Titulo: Infected, Estado: Released, Sinopsis: A blood virus infects a small group of hunters turning a father & son trip into a fight for survival., Generos: horror, action, science fiction, Empresas_productoras: Woodhaven Production Company, Idiomas_hablados: English, palabras_clave: dystopia, infection, rhode island, survival, lyme disease, zombie apocalypse"
53994,Dragon Fighter,3.579,19,Released,2003-01-04,0,85,False,/qO08kPS10TX9odb7UaIptyVVIcC.jpg,0,,tt0312640,en,Dragon Fighter,"The movie begins in Southern England in the Middle Ages and then six knights are seen riding in horses towards a destroyed town. They see the remains of burned buildings and dead people until they come upon a mother and her dead baby. She quickly dies and then a rhino-sized dragon flies overhead, the knights follow right behind, vowing to kill the creature.",3.318,/y07jMH4lzqyduzxkPdXaOytLfnx.jpg,,"action, horror, science fiction, thriller","Dragon Productions LLC, Angry Dragon Entertainment, Unified Film Organization",United States of America,English,"dragon, present day","Titulo: Dragon Fighter, Estado: Released, Sinopsis: The movie begins in Southern England in the Middle Ages and then six knights are seen riding in horses towards a destroyed town. They see the remains of burned buildings and dead people until they come upon a mother and her dead baby. She quickly dies and then a rhino-sized dragon flies overhead, the knights follow right behind, vowing to kill the creature., Generos: action, horror, science fiction, thriller, Empresas_productoras: Dragon Productions LLC, Angry Dragon Entertainment, Unified Film Organization, Idiomas_hablados: English, palabras_clave: dragon, present day"
934194,Slash/Back,5.842,19,Released,2022-06-24,0,87,False,/vruRG9oFSC2QI3F6vLAsj1ND14S.jpg,0,,tt9050310,en,Slash/Back,"In a remote Arctic community, a group of Inuit girls fight off an alien invasion, all while trying to make it to the coolest party in town.",5.872,/cPIv1GTZJokL5TasJxFfVNG9TiM.jpg,These aliens messed with the wrong girls.,"science fiction, action, thriller, horror","Good Question Media, Mixtape VR, Red Marrow Media, Scythia Films, Stellar Citizens",Canada,English,,"Titulo: Slash/Back, Estado: Released, Sinopsis: In a remote Arctic community, a group of Inuit girls fight off an alien invasion, all while trying to make it to the coolest party in town., Generos: science fiction, action, thriller, horror, Empresas_productoras: Good Question Media, Mixtape VR, Red Marrow Media, Scythia Films, Stellar Citizens, Idiomas_hablados: English, palabras_clave: nan"
117326,The Cat,6.6,19,Released,1992-10-22,0,84,False,/45NTbfNeq6xrIxAF5LA2vrF4eJ9.jpg,0,,tt0105796,cn,衛斯理之老貓,A cat from outer space teams up with a young girl and an old man to fight a murderous alien that possesses people.,6.587,/1yGje8a5FAEf7OyZozbTgmJhCEf.jpg,,"horror, science fiction, action","Paragon Films Ltd., Orange Sky Golden Harvest",Hong Kong,Cantonese,"cat, alien","Titulo: The Cat, Estado: Released, Sinopsis: A cat from outer space teams up with a young girl and an old man to fight a murderous alien that possesses people., Generos: horror, science fiction, action, Empresas_productoras: Paragon Films Ltd., Orange Sky Golden Harvest, Idiomas_hablados: Cantonese, palabras_clave: cat, alien"
631191,Corporate Monster,7.3,19,Released,2019-09-16,0,17,False,/cvH4tO4qXWFqfHjpQXGPDtjKg0R.jpg,0,,tt10378788,en,Corporate Monster,"After being phased out of his job, a dangerously unstable man’s life spirals out of control when the prescription pills he takes start to have a side effect: they allow him to see the parasitic beings that have long been puppeteering our world from the shadows.",1.995,/lG1Zfmuz60etBbPlHEBX1KAyZAm.jpg,There Are Monsters Living Among Us,"action, horror, science fiction",,"Ireland, United States of America",English,short film,"Titulo: Corporate Monster, Estado: Released, Sinopsis: After being phased out of his job, a dangerously unstable man’s life spirals out of control when the prescription pills he takes start to have a side effect: they allow him to see the parasitic beings that have long been puppeteering our world from the shadows., Generos: action, horror, science fiction, Empresas_productoras: nan, Idiomas_hablados: English, palabras_clave: short film"
143136,Yonggary,2.7,19,Released,1999-07-17,0,98,False,/jyg3GYXIf5hhNZ7NvoPoCArAYpz.jpg,0,,tt0272425,ko,용가리,"A team of scientists working on a remote dig site find the buried body of an enormous monster, perfectly preserved even after 200 million years. As soon as the beast is uncovered, however, an alien spacecraft suddenly appears above them and brings the monster back to life! The creature immediately sets about levelling the surrounding urban landscape and shrugging off the best firepower the military can throw at it. A lone scientist, working on decrypting an ancient set of hieroglyphics, may be on the verge of finding the aliens' weak point, but will it be too late?",4.76,/2cvqGP48RZX10gyrNcSoJzRZk1m.jpg,Think Bigger,"science fiction, action, fantasy, adventure, horror","Zero Nine Entertainment, Younggu-Art Movies, Korea Pictures",South Korea,"English, Korean","spacecraft, giant monster, remake, dinosaur, alien invasion, reboot, kaiju","Titulo: Yonggary, Estado: Released, Sinopsis: A team of scientists working on a remote dig site find the buried body of an enormous monster, perfectly preserved even after 200 million years. As soon as the beast is uncovered, however, an alien spacecraft suddenly appears above them and brings the monster back to life! The creature immediately sets about levelling the surrounding urban landscape and shrugging off the best firepower the military can throw at it. A lone scientist, working on decrypting an ancient set of hieroglyphics, may be on the verge of finding the aliens' weak point, but will it be too late?, Generos: science fiction, action, fantasy, adventure, horror, Empresas_productoras: Zero Nine Entertainment, Younggu-Art Movies, Korea Pictures, Idiomas_hablados: English, Korean, palabras_clave: spacecraft, giant monster, remake, dinosaur, alien invasion, reboot, kaiju"
47065,Tales of an Ancient Empire,3.079,19,Released,2010-07-31,0,86,False,/iUdCo56cbKRwayGYPe2cDjctbu0.jpg,1000000,,tt1136688,en,Tales of an Ancient Empire,A princess is on a quest to unite the five greatest warriors to save her kingdom from a demon sorceress.,4.642,/nJN1ptRJjMmx4m0gup0ppO7Cmgb.jpg,,"adventure, fantasy, horror, action, thriller, science fiction",,"Argentina, United States of America","German, English","demon, warrior, sorceress, quest, sword and sorcery","Titulo: Tales of an Ancient Empire, Estado: Released, Sinopsis: A princess is on a quest to unite the five greatest warriors to save her kingdom from a demon sorceress., Generos: adventure, fantasy, horror, action, thriller, science fiction, Empresas_productoras: nan, Idiomas_hablados: German, English, palabras_clave: demon, warrior, sorceress, quest, sword and sorcery"
16922,Heatstroke,2.8,19,Released,2008-05-31,0,85,False,/xotoYEX5V5KQQSBBI1oxhBwMRWw.jpg,0,,tt0925245,en,Heatstroke,An ex-model teams up with a soldier to thwart aliens who are propelling global warming to make Earth habitable for their species,5.126,/4Sy2IXjB71kLz0PkOVEjwOONKpi.jpg,,"action, science fiction, horror","TalkStory Productions, Tumidor",,English,,"Titulo: Heatstroke, Estado: Released, Sinopsis: An ex-model teams up with a soldier to thwart aliens who are propelling global warming to make Earth habitable for their species, Generos: action, science fiction, horror, Empresas_productoras: TalkStory Productions, Tumidor, Idiomas_hablados: English, palabras_clave: nan"
11926,The Vanguard,3.868,19,Released,2008-02-07,0,89,False,/zXFutRw15r9KbChv8vHLgkzL1r2.jpg,0,,tt0977669,en,The Vanguard,The year is 2015 and overpopulation and famine have plunged our planet into chaos and one desperate survivor finds himself being hunted and pursued by hordes of rage-crazed zombies.,3.471,/97P4QE9z3X2kRek659u0ZoTlzDy.jpg,,"action, horror, science fiction",Propaganda Pictures,United Kingdom,English,"nightmare, infection, zombie","Titulo: The Vanguard, Estado: Released, Sinopsis: The year is 2015 and overpopulation and famine have plunged our planet into chaos and one desperate survivor finds himself being hunted and pursued by hordes of rage-crazed zombies., Generos: action, horror, science fiction, Empresas_productoras: Propaganda Pictures, Idiomas_hablados: English, palabras_clave: nightmare, infection, zombie"
39912,Cemetery Gates,3.417,18,Released,2006-05-30,0,92,False,/rPeI2PGTpkl2KycnblfRwokNwaV.jpg,930000,,tt0402904,en,Cemetery Gates,"When two ecologists break-in the laboratory of Dr. Belmont, they find a box with a subject and they decide to set the experiment free in the woods. During the transportation, the box opens and releases the mutant Tasmanian Devil that devours the two activists and escapes to the woods. Meanwhile, Dr. Belmont's son Hunter travels in a van with four friends to film a horror movie in the cemetery in the woods, while Belmont and his associate Dr. Christine Kollar seek their deadly experiment called Precious.",4.034,/f6aHjoxXeUKjC2pmu98X5SOAVyl.jpg,Meet the new gate keeper.,"horror, science fiction, action",,United States of America,"English, Polish",mutation,"Titulo: Cemetery Gates, Estado: Released, Sinopsis: When two ecologists break-in the laboratory of Dr. Belmont, they find a box with a subject and they decide to set the experiment free in the woods. During the transportation, the box opens and releases the mutant Tasmanian Devil that devours the two activists and escapes to the woods. Meanwhile, Dr. Belmont's son Hunter travels in a van with four friends to film a horror movie in the cemetery in the woods, while Belmont and his associate Dr. Christine Kollar seek their deadly experiment called Precious., Generos: horror, science fiction, action, Empresas_productoras: nan, Idiomas_hablados: English, Polish, palabras_clave: mutation"
614208,The Ascent,5.111,18,Released,2019-10-17,0,103,False,/9clm1gYq46wqaBPjtTdkKVycHit.jpg,0,,tt8439934,en,The Ascent,"Special ops squad ""Hell's Bastards"" are sent to infiltrate a civil war to retrieve intel. The unit soon find themselves trapped on a never-ending stairwell forced to climb or die. To survive, they must revisit their past sins if they ever want to get off.",3.856,/e1VAPD49YIrMnN7bRBS6ZPiNrUS.jpg,Don't go down,"horror, action, science fiction",Mosley Productions,United Kingdom,English,,"Titulo: The Ascent, Estado: Released, Sinopsis: Special ops squad ""Hell's Bastards"" are sent to infiltrate a civil war to retrieve intel. The unit soon find themselves trapped on a never-ending stairwell forced to climb or die. To survive, they must revisit their past sins if they ever want to get off., Generos: horror, action, science fiction, Empresas_productoras: Mosley Productions, Idiomas_hablados: English, palabras_clave: nan"
234124,The Dead Inside,3.833,18,Released,2013-10-14,0,120,False,,25000,,tt1893415,en,The Dead Inside,"A bad night out just got a fair bit worse, it's the end of the world! Something terrible has happened, the undead are out in force; roaming the streets and devouring all who get in their way. A group of soldiers, civilians and teenagers take shelter in a local school for protection from the undead hordes outside, but no rescue is coming. Food is running low - morale doubly so, tensions are high and things are looking bad when a stranger arrives outside the gate. Then they get a whole lot worse.",2.794,/bi3CVBr4E0syqy6xhZewTGZnSCh.jpg,Get Out Before They Get In,"horror, action, science fiction",Hundy Gilbert Media Ltd.,United Kingdom,English,"high school, great britain, gore, tension, zombie, struggle for survival, group of friends, soldiers","Titulo: The Dead Inside, Estado: Released, Sinopsis: A bad night out just got a fair bit worse, it's the end of the world! Something terrible has happened, the undead are out in force; roaming the streets and devouring all who get in their way. A group of soldiers, civilians and teenagers take shelter in a local school for protection from the undead hordes outside, but no rescue is coming. Food is running low - morale doubly so, tensions are high and things are looking bad when a stranger arrives outside the gate. Then they get a whole lot worse., Generos: horror, action, science fiction, Empresas_productoras: Hundy Gilbert Media Ltd., Idiomas_hablados: English, palabras_clave: high school, great britain, gore, tension, zombie, struggle for survival, group of friends, soldiers"
16067,Final Days of Planet Earth,4.8,18,Released,2006-03-15,0,170,False,,0,,tt0478073,en,Final Days of Planet Earth,An archaeologist discovers that aliens posing as government officials are secretly harvesting human bodies in a bid to take over earth.,3.756,/dW8lvvTmxZ5CTZKRwtqTrO1K1sA.jpg,,"action, science fiction, drama, horror","Hallmark Entertainment, Reunion Pictures",United States of America,"English, Serbo-Croatian","space invasion, alien, end-of-days, alien planet","Titulo: Final Days of Planet Earth, Estado: Released, Sinopsis: An archaeologist discovers that aliens posing as government officials are secretly harvesting human bodies in a bid to take over earth., Generos: action, science fiction, drama, horror, Empresas_productoras: Hallmark Entertainment, Reunion Pictures, Idiomas_hablados: English, Serbo-Croatian, palabras_clave: space invasion, alien, end-of-days, alien planet"
54653,Gangs of the Dead,3.333,18,Released,2006-06-30,0,90,False,/z8bxRBhCN9KbZ226kqCaoKYiyow.jpg,0,,tt0436498,en,Gangs of the Dead,"On the verge of a major arms deal, the two toughest gangs in L.A. will find themselves trapped in an abandoned warehouse by a ravenous mob of bloodthirsty zombies. They will have to work together with the cops to avoid being torn limb-from-limb and eaten alive. A one of a kind urban-zombie film, Gangs of the Dead is a gore-filled and action-packed thriller for both the horror fan and the urban audience.",1.946,/bjVqT8XIVMTCWpSreMpH0W6Rjxi.jpg,Die Hard Or...Rot,"horror, action, science fiction",Outside Productions,United States of America,English,,"Titulo: Gangs of the Dead, Estado: Released, Sinopsis: On the verge of a major arms deal, the two toughest gangs in L.A. will find themselves trapped in an abandoned warehouse by a ravenous mob of bloodthirsty zombies. They will have to work together with the cops to avoid being torn limb-from-limb and eaten alive. A one of a kind urban-zombie film, Gangs of the Dead is a gore-filled and action-packed thriller for both the horror fan and the urban audience., Generos: horror, action, science fiction, Empresas_productoras: Outside Productions, Idiomas_hablados: English, palabras_clave: nan"
