id,title,vote_average,vote_count,status,release_date,revenue,runtime,adult,backdrop_path,budget,homepage,imdb_id,original_language,original_title,overview,popularity,poster_path,tagline,genres,production_companies,production_countries,spoken_languages,keywords,data
438890,Kamen Rider: Run All Over the World,9.5,2,Released,1989-04-29,0,16,False,/xJDVMSfVryNsyxszn8dGdURGmIG.jpg,0,,tt0156681,ja,仮面ライダー 世界に駆ける,"In the film, the Crisis Empire devise a plan to defeat Kohtaro Minami by reverting him back to his old form of Kamen Rider Black and sending out several revived monsters after him. However, Kamen Rider Black is assisted by another RX, who used a time warp to help his past self. The two are joined by RX's alternate forms of Robo Rider and Bio Rider and the four Kamen Riders combine their powers to defeat the revived monsters.",0.911,/n0AQnPzsTAKUm4OhL314SbUuw3y.jpg,,"science fiction, action, adventure, drama, horror, mystery","Ishinomori Productions, Toei Company",Japan,Japanese,"superhero, time travel, superhero teamup, kamen rider","Titulo: Kamen Rider: Run All Over the World, Estado: Released, Sinopsis: In the film, the Crisis Empire devise a plan to defeat Kohtaro Minami by reverting him back to his old form of Kamen Rider Black and sending out several revived monsters after him. However, Kamen Rider Black is assisted by another RX, who used a time warp to help his past self. The two are joined by RX's alternate forms of Robo Rider and Bio Rider and the four Kamen Riders combine their powers to defeat the revived monsters., Generos: science fiction, action, adventure, drama, horror, mystery, Empresas_productoras: Ishinomori Productions, Toei Company, Idiomas_hablados: Japanese, palabras_clave: superhero, time travel, superhero teamup, kamen rider"
1062839,2025 Armageddon,2.5,2,Released,2022-12-16,0,90,False,/ejCp6BfEwR34jike1owX5zD92tr.jpg,0,,tt24057390,en,2025 Armageddon,A militant alien race launches an attack on Earth using gigantic creatures and geological disasters all based on those found on The Asylum's Movie Channel signal which reached their planet.,2.623,/uUdBpr84ceikxTEUe33Ub8XNNKY.jpg,Welcome to the multiverse.,"action, science fiction, horror",The Asylum,United States of America,English,"mutant, shark attack, giant monster, sequel, alien, disaster, alien invasion, shark, killer shark, mutant animal, kaiju, crossover","Titulo: 2025 Armageddon, Estado: Released, Sinopsis: A militant alien race launches an attack on Earth using gigantic creatures and geological disasters all based on those found on The Asylum's Movie Channel signal which reached their planet., Generos: action, science fiction, horror, Empresas_productoras: The Asylum, Idiomas_hablados: English, palabras_clave: mutant, shark attack, giant monster, sequel, alien, disaster, alien invasion, shark, killer shark, mutant animal, kaiju, crossover"
362844,Survivor,3.5,2,Released,1999-05-13,0,90,False,,0,,tt0187534,en,Survivor,"An Arctic oil rig crew discovers something strange far beneath the Earth's surface, which may or may not be responsible for the series of murders that begin to take place.",1.308,/u1frXP9YEkFcpaZlz59pc19JFMJ.jpg,,"action, horror, science fiction, mystery, tv movie",,United States of America,English,,"Titulo: Survivor, Estado: Released, Sinopsis: An Arctic oil rig crew discovers something strange far beneath the Earth's surface, which may or may not be responsible for the series of murders that begin to take place., Generos: action, horror, science fiction, mystery, tv movie, Empresas_productoras: nan, Idiomas_hablados: English, palabras_clave: nan"
359299,Yoshie Zero,6.5,2,Released,2010-08-06,0,14,False,,0,,,ja,Yoshie Zero,A short film prequel to Mutant Girls Squad.,1.138,/zgkSamxzYi6BPkmlDjpCC8Essrh.jpg,,"science fiction, comedy, action, horror",,Japan,Japanese,,"Titulo: Yoshie Zero, Estado: Released, Sinopsis: A short film prequel to Mutant Girls Squad., Generos: science fiction, comedy, action, horror, Empresas_productoras: nan, Idiomas_hablados: Japanese, palabras_clave: nan"
448503,Unmatta,0.0,2,Released,2019-02-22,0,110,False,/g1btrWDoWMOl41axD9M2YgpZdve.jpg,100000,http://www.unmatta.com,tt4602654,mr,उन्मत्त,“Unmatta” is an upcoming Marathi sci-fi action thriller produced by “24FS Chitra”. It is a story of five students who invent a new kind of hallucination drug and experiment with it. It has twisted story-line with lot of action and special effects.,0.6,/oAWXjjGTrkrdAlSeGGq0IZOwFoF.jpg,Be careful what you dream...,"science fiction, action, horror, thriller",24fs Chitra,India,"English, Hindi, Marathi",,"Titulo: Unmatta, Estado: Released, Sinopsis: “Unmatta” is an upcoming Marathi sci-fi action thriller produced by “24FS Chitra”. It is a story of five students who invent a new kind of hallucination drug and experiment with it. It has twisted story-line with lot of action and special effects., Generos: science fiction, action, horror, thriller, Empresas_productoras: 24fs Chitra, Idiomas_hablados: English, Hindi, Marathi, palabras_clave: nan"
977542,Jurassic Revival,3.0,2,Released,2022-05-29,0,71,False,/6jUq5kfrsZfJcp9v3548SuPythn.jpg,0,,,zh,复活侏罗纪,"After finding a mysterious ghost island, geologist Zhao Qiming leads a team to investigate the island's secrets. However, none of them survives in the mysterious place. 10 years later, Zhao Qiming's daughter Zhao Xueli is also a great scientist, who never gave up learning the truth about the ghost island and what happened to the scientific expedition team. At the same time, Du Zhe, a wealthy Southeast Asian businessman, wants the legendary meteorite, forcing Zhao Xueli to cooperate with him and form a scientific expedition team to go to the ghost island. Thinking it'd be just an ordinary adventure, they face an unprecedented crisis – the ghost island is inhabited by Jurassic dinosaurs.",1.568,/nK70jwC5FSxCf7vWcoZdYDvRgVn.jpg,,"action, adventure, horror, science fiction",,China,Mandarin,"velociraptor, tyrannosaurus rex, giant monster, giant snake, dinosaur, jurassic","Titulo: Jurassic Revival, Estado: Released, Sinopsis: After finding a mysterious ghost island, geologist Zhao Qiming leads a team to investigate the island's secrets. However, none of them survives in the mysterious place. 10 years later, Zhao Qiming's daughter Zhao Xueli is also a great scientist, who never gave up learning the truth about the ghost island and what happened to the scientific expedition team. At the same time, Du Zhe, a wealthy Southeast Asian businessman, wants the legendary meteorite, forcing Zhao Xueli to cooperate with him and form a scientific expedition team to go to the ghost island. Thinking it'd be just an ordinary adventure, they face an unprecedented crisis – the ghost island is inhabited by Jurassic dinosaurs., Generos: action, adventure, horror, science fiction, Empresas_productoras: nan, Idiomas_hablados: Mandarin, palabras_clave: velociraptor, tyrannosaurus rex, giant monster, giant snake, dinosaur, jurassic"
322658,Time Burst: The Final Alliance,3.0,2,Released,1989-01-01,0,93,False,/cdHqSkJBwUCR8oTfe2ZhK77lfRL.jpg,0,,tt0242952,en,Time Burst: The Final Alliance,Several different factions compete in the search for ancient Japanese tablets that have the secret of immortality.,1.214,/uDP2xo8jyUg5BaTIRlffJKXCIO.jpg,He stole the secret of immortality... now it may cost him his life!,"horror, fantasy, action, science fiction",Action International Pictures,United States of America,English,samurai,"Titulo: Time Burst: The Final Alliance, Estado: Released, Sinopsis: Several different factions compete in the search for ancient Japanese tablets that have the secret of immortality., Generos: horror, fantasy, action, science fiction, Empresas_productoras: Action International Pictures, Idiomas_hablados: English, palabras_clave: samurai"
1321865,Fuck it: Fallen by revenge,7.0,2,Released,2024-07-14,731471,0,True,/qStqOBBbZr2VG6QjF6c3n5rN7BK.jpg,1,,,ru,Fuck it: Fallen by revenge,,0.0,/9rEA1TYFDmZPJXSHsSJCRTwoiF6.jpg,,"comedy, action, drama, science fiction, horror",TEA SET PRODUCTION,Russia,English,"падший местью, похуй, мир дружба жвачка, боевик, сага мутантов","Titulo: Fuck it: Fallen by revenge, Estado: Released, Sinopsis: nan, Generos: comedy, action, drama, science fiction, horror, Empresas_productoras: TEA SET PRODUCTION, Idiomas_hablados: English, palabras_clave: падший местью, похуй, мир дружба жвачка, боевик, сага мутантов"
99658,A.F. Archetypes Forces,5.0,2,Released,2002-09-06,0,15,False,,0,,,ja,A.F,"It is the year 2124, and the crew of a medical transport ship are carrying dangerous cargo to its destination. The contents, though mostly unknown, are rumored to be viral in nature, and must not be let out under any circumstances. But when a leak occurs, the ship, as well as the crew, is at risk of being destroyed. With only two robotic space suits and limited ammo, can they escape in time, or are their fates sealed?",1.196,/1ZdpgXext9u7noT8FcH1kguXDHc.jpg,,"animation, action, science fiction, horror",,,Japanese,,"Titulo: A.F. Archetypes Forces, Estado: Released, Sinopsis: It is the year 2124, and the crew of a medical transport ship are carrying dangerous cargo to its destination. The contents, though mostly unknown, are rumored to be viral in nature, and must not be let out under any circumstances. But when a leak occurs, the ship, as well as the crew, is at risk of being destroyed. With only two robotic space suits and limited ammo, can they escape in time, or are their fates sealed?, Generos: animation, action, science fiction, horror, Empresas_productoras: nan, Idiomas_hablados: Japanese, palabras_clave: nan"
105924,Meatball Machine: Reject of Death,6.5,2,Released,2007-02-07,0,10,False,/jdqQBiGHlzq8LZIk83nhsrekg4V.jpg,0,,tt1592747,ja,Meatball Machine: Reject of Death,Shortfilm sequel to the movie Meatball Machine. There is no real action but we'll see a bunch of aliens kill both each other and humans.,1.149,/gOvic7oiv9GQcHELHdJJTBfgR5d.jpg,,"action, horror, science fiction","Nishimura Motion Picture Model Makers Group, King Records",Japan,Japanese,"alien, fundoshi","Titulo: Meatball Machine: Reject of Death, Estado: Released, Sinopsis: Shortfilm sequel to the movie Meatball Machine. There is no real action but we'll see a bunch of aliens kill both each other and humans., Generos: action, horror, science fiction, Empresas_productoras: Nishimura Motion Picture Model Makers Group, King Records, Idiomas_hablados: Japanese, palabras_clave: alien, fundoshi"
37846,Vorvik,5.0,2,Released,2005-08-12,0,100,False,,0,,tt0445817,es,Vorvik,"The president of a major biogenetic laboratory crazy for a board and falls down dead. His daughter Sofia inherited, just eighteen years a true empire, and make it impossible to discover the cause of the strange death of his father.",1.806,,,"action, adventure, horror, science fiction",,,Spanish,,"Titulo: Vorvik, Estado: Released, Sinopsis: The president of a major biogenetic laboratory crazy for a board and falls down dead. His daughter Sofia inherited, just eighteen years a true empire, and make it impossible to discover the cause of the strange death of his father., Generos: action, adventure, horror, science fiction, Empresas_productoras: nan, Idiomas_hablados: Spanish, palabras_clave: nan"
813313,Big Octopus,5.8,2,Released,2020-02-13,0,86,False,,0,,tt13506320,zh,Dà zhangyú,A restaurant owner finds a strange baby octopus that leads to chaos.,0.774,/92OuKljhXfwoUTcNVABPDJH3CKZ.jpg,,"science fiction, fantasy, adventure, action, horror",YOUKU,China,Mandarin,,"Titulo: Big Octopus, Estado: Released, Sinopsis: A restaurant owner finds a strange baby octopus that leads to chaos., Generos: science fiction, fantasy, adventure, action, horror, Empresas_productoras: YOUKU, Idiomas_hablados: Mandarin, palabras_clave: nan"
335185,The Equinox...A Journey Into the Supernatural,5.5,2,Released,1967-01-01,0,71,False,,6500,,tt7131660,en,The Equinox...A Journey Into the Supernatural,"Deep within the woods and canyons of California, four teenagers happen upon an ancient book containing the secrets of a strange, malevolent world that coexists with that of mankind.",0.6,/kzc6iOki5mvR7vGGiWBw5KPPJmn.jpg,,"action, horror, science fiction",Berkshire Productions,United States of America,English,,"Titulo: The Equinox...A Journey Into the Supernatural, Estado: Released, Sinopsis: Deep within the woods and canyons of California, four teenagers happen upon an ancient book containing the secrets of a strange, malevolent world that coexists with that of mankind., Generos: action, horror, science fiction, Empresas_productoras: Berkshire Productions, Idiomas_hablados: English, palabras_clave: nan"
1105219,A Triplets Tale,1.5,2,Released,2023-05-10,0,3,False,/y84rlXlUsNGSYI9uOTgF33FPzUZ.jpg,100,https://youtube.com/@StopMotionbyNicholas,tt27232815,en,A Triplets Tale,"Before Scarecrow and after Outré, Experience the Triplets Story in the Scarecrow Timeline",0.6,/1IZj95A2nJnp8tC7aPBAnUDnINZ.jpg,Everything Is Connected,"animation, fantasy, action, horror, science fiction",Stop Motion by Nicholas,,English,stop motion,"Titulo: A Triplets Tale, Estado: Released, Sinopsis: Before Scarecrow and after Outré, Experience the Triplets Story in the Scarecrow Timeline, Generos: animation, fantasy, action, horror, science fiction, Empresas_productoras: Stop Motion by Nicholas, Idiomas_hablados: English, palabras_clave: stop motion"
803182,Moon Men,10.0,2,Released,2017-01-02,550,148,False,,3,http://www.youtube.com/themooringline,,en,Moon Men,"Adrian, Sumner, and Cody live greasy, weird lives down in the south land of Arkansas. Part documentary, part mockumentary, this film follows the boys' filmmaking endeavors over the course of a year. Everything seems to be going smoothly, until one day, their most popular character ""The Mid Man"" escapes from the fictional world and wreaks havoc when he discovers that he's a one note joke created by a group of stoned burnouts.  The first entry of the TML series, released on Adrian’s YouTube channel TheMooringLine.",1.4,/gWqWR6LmcjhPu2uuim8I855eKF6.jpg,"Greetings, from the Summer Of Grease!","action, adventure, comedy, documentary, horror, thriller, science fiction",,,English,,"Titulo: Moon Men, Estado: Released, Sinopsis: Adrian, Sumner, and Cody live greasy, weird lives down in the south land of Arkansas. Part documentary, part mockumentary, this film follows the boys' filmmaking endeavors over the course of a year. Everything seems to be going smoothly, until one day, their most popular character ""The Mid Man"" escapes from the fictional world and wreaks havoc when he discovers that he's a one note joke created by a group of stoned burnouts.  The first entry of the TML series, released on Adrian’s YouTube channel TheMooringLine., Generos: action, adventure, comedy, documentary, horror, thriller, science fiction, Empresas_productoras: nan, Idiomas_hablados: English, palabras_clave: nan"
936252,Privacy Breach,10.0,2,Released,2020-10-31,1,3,False,/dA23UUEAfocRAcMb21Hiv0FhNUu.jpg,10,,,en,Privacy Breach,"After witnessing the violent arrest of Ted Carter (Ethan N), Kit Porter (Henri L), a tech savvy baseball fan, uncovers a secret government conspiracy to watch over every citizen. After teaming up with Max Stone (Josh M) and Doug Reese (Charlie R), the crew try to take down the surveillance systems and restore privacy to the world. Nominated for multiple yo mama awards.  Privacy Breach stands as a potent warning against surveillance, and begs an important question. How far will we go for law and order? After an emotional clip from the film went viral in 2020, directors everywhere looked towards this film for inspiration. Cited as ""Your favourite film-makers favourite film"", Privacy Breach tries, and succeeds, to tell a unique story that will remain unrivaled in the coming decades. 2020 is the new 1984.  Privacy Breach. This aint yo daddys dystopian horror",0.6,/s6RuQ1vfxcy6tq17spBhLGa94QV.jpg,This aint yo daddys dystopian,"science fiction, action, adventure, crime, drama, mystery, thriller, romance, horror",,New Zealand,English,"dystopia, video surveillance, hacking, surveillance, tyranny","Titulo: Privacy Breach, Estado: Released, Sinopsis: After witnessing the violent arrest of Ted Carter (Ethan N), Kit Porter (Henri L), a tech savvy baseball fan, uncovers a secret government conspiracy to watch over every citizen. After teaming up with Max Stone (Josh M) and Doug Reese (Charlie R), the crew try to take down the surveillance systems and restore privacy to the world. Nominated for multiple yo mama awards.  Privacy Breach stands as a potent warning against surveillance, and begs an important question. How far will we go for law and order? After an emotional clip from the film went viral in 2020, directors everywhere looked towards this film for inspiration. Cited as ""Your favourite film-makers favourite film"", Privacy Breach tries, and succeeds, to tell a unique story that will remain unrivaled in the coming decades. 2020 is the new 1984.  Privacy Breach. This aint yo daddys dystopian horror, Generos: science fiction, action, adventure, crime, drama, mystery, thriller, romance, horror, Empresas_productoras: nan, Idiomas_hablados: English, palabras_clave: dystopia, video surveillance, hacking, surveillance, tyranny"
132587,The Occultist,5.5,2,Released,1988-11-01,0,82,False,,0,,tt0093663,en,The Occultist,"A cyborg private eye is hired to protect a Caribbean president visiting New York City. Unknown to him, the president's daughter is in league with his country's rebels who are trying to assassinate him.",1.74,/lI9twFsBhLyBOEr571rslzoDEEJ.jpg,Private dick without a brain.,"horror, science fiction, action, comedy",Beyond Infinity,United States of America,English,,"Titulo: The Occultist, Estado: Released, Sinopsis: A cyborg private eye is hired to protect a Caribbean president visiting New York City. Unknown to him, the president's daughter is in league with his country's rebels who are trying to assassinate him., Generos: horror, science fiction, action, comedy, Empresas_productoras: Beyond Infinity, Idiomas_hablados: English, palabras_clave: nan"
651692,Virtual Death Match,6.0,2,Released,2020-01-04,0,108,False,/q2fbeEoeYPc7KL23OsPrxAovvmW.jpg,0,,tt8444510,en,Virtual Death Match,A group of gamers are selected to take part in a VR competition where only the fittest will survive.,3.47,/pvz9tyZb3wKNsee70PqnmFPLXG5.jpg,,"horror, action, science fiction, adventure",ChampDog Films,United Kingdom,English,,"Titulo: Virtual Death Match, Estado: Released, Sinopsis: A group of gamers are selected to take part in a VR competition where only the fittest will survive., Generos: horror, action, science fiction, adventure, Empresas_productoras: ChampDog Films, Idiomas_hablados: English, palabras_clave: nan"
397245,Seize the Night,4.8,2,Released,2016-05-03,0,13,False,,0,,tt4286494,en,Seize the Night,Renegade vampire assassin Eva has escaped from a secret bio-research compound. Hell bent on revenge she learns a terrible secret that may force her to unite with the devil she knows in order to defeat the greatest of all evils.,0.6,/eBjBuLsDysnnyCYF5qPVVGnm9EK.jpg,,"action, horror, science fiction, thriller",,United Kingdom,English,"london, england, vampire, woman director, short film","Titulo: Seize the Night, Estado: Released, Sinopsis: Renegade vampire assassin Eva has escaped from a secret bio-research compound. Hell bent on revenge she learns a terrible secret that may force her to unite with the devil she knows in order to defeat the greatest of all evils., Generos: action, horror, science fiction, thriller, Empresas_productoras: nan, Idiomas_hablados: English, palabras_clave: london, england, vampire, woman director, short film"
713651,Cold Hard Blood,1.5,2,Released,2020-06-18,0,11,False,,17000,,tt12204850,en,Cold Hard Blood,"In a nightmarish near-future Los Angeles where human blood is a hot commodity, a former criminal sets out on a mission of vengeance against the corrupt evangelist who nearly took everything from her.",1.217,/a7QoV6sAsqwMGn5iFyGe9y5FsMF.jpg,"In 2049, all lives have worth. Some are just worth more than others.","action, horror, science fiction, thriller",Vinyl Velocity Features,United States of America,,"post-apocalyptic future, revenge, social commentary, conspiracy, hospital, hospital fight, female hero, political corruption, televangelist, prosperity gospel","Titulo: Cold Hard Blood, Estado: Released, Sinopsis: In a nightmarish near-future Los Angeles where human blood is a hot commodity, a former criminal sets out on a mission of vengeance against the corrupt evangelist who nearly took everything from her., Generos: action, horror, science fiction, thriller, Empresas_productoras: Vinyl Velocity Features, Idiomas_hablados: nan, palabras_clave: post-apocalyptic future, revenge, social commentary, conspiracy, hospital, hospital fight, female hero, political corruption, televangelist, prosperity gospel"
849736,Godzilla the Ride: Giant Monsters Ultimate Battle,10.0,2,Released,2021-07-04,0,5,False,,0,,,ja,ゴジラ・ザ・ライド 大怪獣頂上決戦,"Godzilla the Ride: Giant Monsters Ultimate Battle (ゴジラ・ザ・ライド 大怪獣頂上決戦 Gojira za Raido Daikaijū Chōjō Kessen), or simply Godzilla the Ride (ゴジラ・ザ・ライド Gojira za Raido), is a flying theater motion simulator ride located in the Seibuen amusement park in Tokorozawa, Saitama, Japan. Up to 70 guests are placed at the center of a battle between Godzilla and King Ghidorah.[1] It opened on May 19, 2021, in conjunction with the park's grand reopening.[2] The five-minute[1] ride film is directed by Takashi Yamazaki, who previously directed Godzilla in the 2007 film Always: Sunset on Third Street 2, in partnership with Shoichiro Tsuno of Katana Marketing and Entertainment Co., Ltd.",0.6,/u3AiPpIZusBMBvQKGsazs57Np6O.jpg,,"horror, action, science fiction",,,,,"Titulo: Godzilla the Ride: Giant Monsters Ultimate Battle, Estado: Released, Sinopsis: Godzilla the Ride: Giant Monsters Ultimate Battle (ゴジラ・ザ・ライド 大怪獣頂上決戦 Gojira za Raido Daikaijū Chōjō Kessen), or simply Godzilla the Ride (ゴジラ・ザ・ライド Gojira za Raido), is a flying theater motion simulator ride located in the Seibuen amusement park in Tokorozawa, Saitama, Japan. Up to 70 guests are placed at the center of a battle between Godzilla and King Ghidorah.[1] It opened on May 19, 2021, in conjunction with the park's grand reopening.[2] The five-minute[1] ride film is directed by Takashi Yamazaki, who previously directed Godzilla in the 2007 film Always: Sunset on Third Street 2, in partnership with Shoichiro Tsuno of Katana Marketing and Entertainment Co., Ltd., Generos: horror, action, science fiction, Empresas_productoras: nan, Idiomas_hablados: nan, palabras_clave: nan"
239722,Infestation,1.5,2,Released,2005-07-08,0,89,False,/a4mytABCrcOmSZJ17FT9gBjU68L.jpg,0,,tt0480540,en,Infestation,"The not too distant future. A deadly virus has swept across the Earth. Billions perished. The survivors moved underground . . . 30 years on and plagued with self-blame following a devastating crash, pilot Loki is coaxed back from the edge by his partner Sash. Together they must take on a new mission: Go Topside. Retrieve missing recon team. Hostility unknown. After a thunderous journey through the Earth's crust they discover the planet surface is not what it once was, only death survives. As they quickly uncover the fate that befell the first team, they are forced to make a choice, either stay and die or stay and fight. But what will kill them first, the mutants or the virus?",0.657,/sM0Kx7nlT17uCncnvOgUE3TFNV0.jpg,,"horror, action, science fiction","ESP Productions Ltd., Racing Snake Films, Fierce Productions",United Kingdom,English,"pilot, apocalypse, zombie, zombie apocalypse, virus, mutants, plague survivors, underground city, plane crash","Titulo: Infestation, Estado: Released, Sinopsis: The not too distant future. A deadly virus has swept across the Earth. Billions perished. The survivors moved underground . . . 30 years on and plagued with self-blame following a devastating crash, pilot Loki is coaxed back from the edge by his partner Sash. Together they must take on a new mission: Go Topside. Retrieve missing recon team. Hostility unknown. After a thunderous journey through the Earth's crust they discover the planet surface is not what it once was, only death survives. As they quickly uncover the fate that befell the first team, they are forced to make a choice, either stay and die or stay and fight. But what will kill them first, the mutants or the virus?, Generos: horror, action, science fiction, Empresas_productoras: ESP Productions Ltd., Racing Snake Films, Fierce Productions, Idiomas_hablados: English, palabras_clave: pilot, apocalypse, zombie, zombie apocalypse, virus, mutants, plague survivors, underground city, plane crash"
