id,title,vote_average,vote_count,status,release_date,revenue,runtime,adult,backdrop_path,budget,homepage,imdb_id,original_language,original_title,overview,popularity,poster_path,tagline,genres,production_companies,production_countries,spoken_languages,keywords,data
33555,Sherlock Holmes,5.099,86,Released,2010-01-26,0,89,False,/6Exoar3dK8Bv57ejK4ii3FXdSXx.jpg,1000000,,tt1522835,en,Sherlock Holmes,Sherlock Holmes and Watson are on the trail of a criminal and scientific mastermind who seems to control monsters and creations which defy belief.,8.179,/wsJkEzktZV83DXlQItsO1ooGGq0.jpg,The world's greatest detective has finally met his match.,"fantasy, horror, action, mystery, science fiction",The Asylum,"United Kingdom, United States of America",English,"woman director, sherlock holmes","Titulo: Sherlock Holmes, Estado: Released, Sinopsis: Sherlock Holmes and Watson are on the trail of a criminal and scientific mastermind who seems to control monsters and creations which defy belief., Generos: fantasy, horror, action, mystery, science fiction, Empresas_productoras: The Asylum, Idiomas_hablados: English, palabras_clave: woman director, sherlock holmes"
18726,Perfect Creature,5.351,84,Released,2007-08-16,0,90,False,,0,,tt0403407,en,Perfect Creature,"The vampire myth is given a stylish 1960s treatment, where a human cop partners with a vampire cop to stop a vamp bent on creating a war between the two ""separate but equal"" races.",10.139,/dimESyMjhfzmukbisslB3djbXhQ.jpg,,"action, science fiction, drama, fantasy, horror","Spice Factory, Sensible Films, Roc Media","New Zealand, United Kingdom",English,"quarantine, vampire, bite, new zealand, religion, steampunk, fictional war, demon, epidemic, influenza, parallel universe","Titulo: Perfect Creature, Estado: Released, Sinopsis: The vampire myth is given a stylish 1960s treatment, where a human cop partners with a vampire cop to stop a vamp bent on creating a war between the two ""separate but equal"" races., Generos: action, science fiction, drama, fantasy, horror, Empresas_productoras: Spice Factory, Sensible Films, Roc Media, Idiomas_hablados: English, palabras_clave: quarantine, vampire, bite, new zealand, religion, steampunk, fictional war, demon, epidemic, influenza, parallel universe"
249260,Avalanche Sharks,3.399,84,Released,2014-01-01,0,82,False,/rZowlIsA2lZDnoS24UQs2bkYTkN.jpg,0,,tt2622826,en,Avalanche Sharks,"A snow avalanche awakens humungous, prehistoric sharks that proceed to chomp on bikini clad co-eds.",6.59,/c8XL1mLik4IdRsEpcPUdcm8RxR9.jpg,Beware Of Frost Bites,"horror, action, science fiction, adventure, comedy","Odyssey Media, Pulser Productions, Rogue State, The Cartel","Canada, United States of America",English,"bikini, hot tub, curse, scientist, shark, avalanche","Titulo: Avalanche Sharks, Estado: Released, Sinopsis: A snow avalanche awakens humungous, prehistoric sharks that proceed to chomp on bikini clad co-eds., Generos: horror, action, science fiction, adventure, comedy, Empresas_productoras: Odyssey Media, Pulser Productions, Rogue State, The Cartel, Idiomas_hablados: English, palabras_clave: bikini, hot tub, curse, scientist, shark, avalanche"
549787,Tokyo Ghoul 'S',6.6,84,Released,2019-07-19,0,97,False,/qToBysnrN4lFTyEwrqSz9LX8YS9.jpg,0,http://shochikufilms.com/product/tokyo-ghoul-2-2,tt9179260,ja,東京喰種 トーキョーグール 【S】,"Now a member of Anteiku, Ken Kaneki grows closer to the ghouls around him. Determined to protect his new home against anti-ghoul forces, he trains his powers in secret. But when the infamous gourmet, Shū Tsukiyama, wishes to savour some half-ghoul flavour, Kaneki's training is put to test of a lifetime.",19.906,/nMTiDEye1BwnQP8J1hM3G16EEmX.jpg,To eat or to be eaten,"action, horror, science fiction, fantasy",,Japan,Japanese,,"Titulo: Tokyo Ghoul 'S', Estado: Released, Sinopsis: Now a member of Anteiku, Ken Kaneki grows closer to the ghouls around him. Determined to protect his new home against anti-ghoul forces, he trains his powers in secret. But when the infamous gourmet, Shū Tsukiyama, wishes to savour some half-ghoul flavour, Kaneki's training is put to test of a lifetime., Generos: action, horror, science fiction, fantasy, Empresas_productoras: nan, Idiomas_hablados: Japanese, palabras_clave: nan"
49158,Tentacles,4.717,83,Released,1977-02-25,3000000,102,False,/jPynXxoz4pfR6z432Uawb7GogwG.jpg,750000,,tt0076809,it,Tentacoli,"Several people disappear from and at the sea. Their bodies are found gnawed to the skeleton, even the marrow is missing. The scientists have no idea which animal could do such things. Dr. Turner begins to suspect that the company which builds a tunnel beneath the bay might have poisoned the environment and caused an octopus to mutate to giant dimensions...",12.165,/aNRqx0Kikz4ve6PP2sjWMjGPIJv.jpg,It's Turning the Beach ... Into a Buffet!,"horror, science fiction, adventure, action","American International Pictures, Esse Ci Cinematografica","Italy, United States of America","Italian, English","octopus, killer whale","Titulo: Tentacles, Estado: Released, Sinopsis: Several people disappear from and at the sea. Their bodies are found gnawed to the skeleton, even the marrow is missing. The scientists have no idea which animal could do such things. Dr. Turner begins to suspect that the company which builds a tunnel beneath the bay might have poisoned the environment and caused an octopus to mutate to giant dimensions..., Generos: horror, science fiction, adventure, action, Empresas_productoras: American International Pictures, Esse Ci Cinematografica, Idiomas_hablados: Italian, English, palabras_clave: octopus, killer whale"
589594,Abduction,6.1,83,Released,2019-03-20,0,98,False,/5wc0ISKonh70lXdLVZ2Le3OA8UB.jpg,0,,tt7867360,en,Abduction,"A man steps out of a park fountain in Ho Chi Minh City with no recollection of who he is or where he came from. As he wanders through the city, piecing together clues to his past, he is relentlessly pursued by mysterious figures.",11.374,/3zeEoWFqz5piolP0TQSIIsm6x8U.jpg,The clock is ticking for the human race…,"horror, science fiction, thriller, action","Red Sea Media, Ace Films",China,"English, Mandarin",,"Titulo: Abduction, Estado: Released, Sinopsis: A man steps out of a park fountain in Ho Chi Minh City with no recollection of who he is or where he came from. As he wanders through the city, piecing together clues to his past, he is relentlessly pursued by mysterious figures., Generos: horror, science fiction, thriller, action, Empresas_productoras: Red Sea Media, Ace Films, Idiomas_hablados: English, Mandarin, palabras_clave: nan"
336265,The Mind's Eye,5.0,82,Released,2015-08-05,0,87,False,/opN4OVsm688CqSbMu8215AX0swQ.jpg,0,,tt4567486,en,The Mind's Eye,"Zack Connors and Rachel Meadows were born with incredible psychokinetic capabilities. When word of their supernatural talents gets out, they find themselves the prisoners of Michael Slovak, a deranged doctor intent on harvesting their powers.",6.29,/ksi1HcjmOh4fptxtv4sekvScQam.jpg,Mind Over Matter.,"horror, science fiction, action","Channel 83 Films, Site B",United States of America,English,psychokinesis,"Titulo: The Mind's Eye, Estado: Released, Sinopsis: Zack Connors and Rachel Meadows were born with incredible psychokinetic capabilities. When word of their supernatural talents gets out, they find themselves the prisoners of Michael Slovak, a deranged doctor intent on harvesting their powers., Generos: horror, science fiction, action, Empresas_productoras: Channel 83 Films, Site B, Idiomas_hablados: English, palabras_clave: psychokinesis"
39899,Turkey Shoot,5.444,82,Released,1982-03-25,0,93,False,/4u4iFWgBifaSIxgk4PTedwtTwp0.jpg,32000000,,tt0082338,en,Turkey Shoot,"In the near future, after an unspecified holocaust, survivors are herded into prison camps. There, they are hunted for sport by the leaders of the camp. Paul, one of the newest prisoners, is determined not to go down as quietly as the others.",11.674,/837jSfdQYvhqToMPfAGdci6zszG.jpg,Experience The Year 2000...And Hope To Hell You Can Escape!,"horror, science fiction, action","FGH, Hemdale Film, Filmco Limited","Australia, United Kingdom",English,"future, rape, escape, sadism, dystopia, dark comedy, machete, satire, survival, werewolf, torture, explosion, exploding body, death","Titulo: Turkey Shoot, Estado: Released, Sinopsis: In the near future, after an unspecified holocaust, survivors are herded into prison camps. There, they are hunted for sport by the leaders of the camp. Paul, one of the newest prisoners, is determined not to go down as quietly as the others., Generos: horror, science fiction, action, Empresas_productoras: FGH, Hemdale Film, Filmco Limited, Idiomas_hablados: English, palabras_clave: future, rape, escape, sadism, dystopia, dark comedy, machete, satire, survival, werewolf, torture, explosion, exploding body, death"
3146,The War of the Gargantuas,6.494,81,Released,1966-07-29,0,88,False,/2NmWzjQIMf9aljNZQh5UrDzuNG2.jpg,0,,tt0060440,ja,フランケンシュタインの怪獣 サンダ対ガイラ,"Gaira, a humanoid sea beast spawned from the discarded cells of Frankenstein's monster, attacks the shores of Tokyo. While the Japanese military prepares to take action, Gaira's Gargantua brother, Sanda, descends from the mountains to defend his kin. A battle between good and evil ensues, leaving brothers divided and a city in ruins.",12.191,/q8EH0y601mhYJmchoTRoo92Q0FS.jpg,"A crisis, striking from the mountains and the sea!","action, horror, science fiction","TOHO, Benedict Pictures Corp., United Productions of America",Japan,Japanese,"monster, airport, octopus, giant monster, sequel, kaiju, man eating monster","Titulo: The War of the Gargantuas, Estado: Released, Sinopsis: Gaira, a humanoid sea beast spawned from the discarded cells of Frankenstein's monster, attacks the shores of Tokyo. While the Japanese military prepares to take action, Gaira's Gargantua brother, Sanda, descends from the mountains to defend his kin. A battle between good and evil ensues, leaving brothers divided and a city in ruins., Generos: action, horror, science fiction, Empresas_productoras: TOHO, Benedict Pictures Corp., United Productions of America, Idiomas_hablados: Japanese, palabras_clave: monster, airport, octopus, giant monster, sequel, kaiju, man eating monster"
226948,Scarecrow,4.897,78,Released,2013-10-05,0,85,False,/l2DWN9SKH5oVAJREcGcCRY4JfEt.jpg,2000000,,tt2071571,en,Scarecrow,"For generations, it was an urban legend that lived in the nightmares of children. Now, the season to rejuvenate the tale will revive a town's darkest fears. With the Scarecrow Festival on the horizon, school teacher Aaron Harris is doling out punishment for six students serving detention. Their task: help Aaron's girlfriend Amanda fix her family farm before it's sold. But the cornfields circling the farm come with a legend and Tyler takes macabre delight in recounting the tale: It never sleeps, it never dies, it can't be stopped, hear their cries.",7.069,/mBaGppPfda1eOlnfLE7tM9yOB0Y.jpg,,"horror, science fiction, action","Brightlight Pictures, Lighthouse Pictures, RHI Entertainment, Sonar Entertainment","Canada, United States of America",English,"farm, urban legend, detention, supernatural creature, killer scarecrow","Titulo: Scarecrow, Estado: Released, Sinopsis: For generations, it was an urban legend that lived in the nightmares of children. Now, the season to rejuvenate the tale will revive a town's darkest fears. With the Scarecrow Festival on the horizon, school teacher Aaron Harris is doling out punishment for six students serving detention. Their task: help Aaron's girlfriend Amanda fix her family farm before it's sold. But the cornfields circling the farm come with a legend and Tyler takes macabre delight in recounting the tale: It never sleeps, it never dies, it can't be stopped, hear their cries., Generos: horror, science fiction, action, Empresas_productoras: Brightlight Pictures, Lighthouse Pictures, RHI Entertainment, Sonar Entertainment, Idiomas_hablados: English, palabras_clave: farm, urban legend, detention, supernatural creature, killer scarecrow"
33305,Scanners III: The Takeover,4.5,77,Released,1992-01-31,0,101,False,/za8Vb4vDqfFOajKQIU7QS8v2bcL.jpg,0,,tt0105322,en,Scanners III: The Takeover,"A young female scanner turns from a sweet young thing into a murderous, power-crazed villain after she takes an experimental drug developed by her father. Her brother, who is also a scanner, is the only one powerful enough to stop her.",5.212,/qrgsczCSUfbaeYJnvMSEmKcGV4X.jpg,The terror has not ended. It has just begun... again.,"horror, science fiction, action","Filmtech, The Image Organization, Lance Entertainment, Malofilm","Canada, United States of America","German, English","computer, drugs","Titulo: Scanners III: The Takeover, Estado: Released, Sinopsis: A young female scanner turns from a sweet young thing into a murderous, power-crazed villain after she takes an experimental drug developed by her father. Her brother, who is also a scanner, is the only one powerful enough to stop her., Generos: horror, science fiction, action, Empresas_productoras: Filmtech, The Image Organization, Lance Entertainment, Malofilm, Idiomas_hablados: German, English, palabras_clave: computer, drugs"
100089,Nazis at the Center of the Earth,3.257,76,Released,2012-04-23,0,90,False,/sydsxMmTHicmb50hRoNDT2bZ804.jpg,0,,tt2130142,en,Nazis at the Center of the Earth,"A group of researchers in Antarctica are abducted by a platoon of masked soldiers and dragged into a hidden continent in the center of the Earth. There, they discover that surviving Nazi soldiers are plotting an invasion of Earth to revive the Third Reich.",7.614,/n4rHq7DKvJVpp3pfyhLUy5OBJp2.jpg,Dead...but not gone,"adventure, action, horror, science fiction, thriller",The Asylum,United States of America,English,"nazi, cyborg, zombie","Titulo: Nazis at the Center of the Earth, Estado: Released, Sinopsis: A group of researchers in Antarctica are abducted by a platoon of masked soldiers and dragged into a hidden continent in the center of the Earth. There, they discover that surviving Nazi soldiers are plotting an invasion of Earth to revive the Third Reich., Generos: adventure, action, horror, science fiction, thriller, Empresas_productoras: The Asylum, Idiomas_hablados: English, palabras_clave: nazi, cyborg, zombie"
16226,Lady Death,7.316,76,Released,2004-07-24,0,80,False,/pP2FrpQdeUYHo7oYT59IEzkuozT.jpg,0,,tt0354690,en,Lady Death,"When accused by the townspeople of being in league with the Devil, Hope finds herself in a satanic deal for her life. After refusing the terms of the deal, she transforms into the powerful Lady Death and vows to wrest control of hell from her father.",4.765,/xVK9NOhb2jhkVqzTOjjnrQ3BUxk.jpg,Naughty girls go to hell... Really naughty girls conquer it.,"fantasy, animation, horror, action, science fiction","ADV Films, A.D. Vision",United States of America,English,"satan, breast, lucifer, demon, adult animation","Titulo: Lady Death, Estado: Released, Sinopsis: When accused by the townspeople of being in league with the Devil, Hope finds herself in a satanic deal for her life. After refusing the terms of the deal, she transforms into the powerful Lady Death and vows to wrest control of hell from her father., Generos: fantasy, animation, horror, action, science fiction, Empresas_productoras: ADV Films, A.D. Vision, Idiomas_hablados: English, palabras_clave: satan, breast, lucifer, demon, adult animation"
522438,6-Headed Shark Attack,4.8,75,Released,2018-08-18,0,89,False,/n0lRst3H7o82lGHdL3Rh1oiJJLZ.jpg,0,,tt8360902,en,6-Headed Shark Attack,"What is supposed to be a marriage boot camp on a remote island turns into the ultimate test for survival when a 6-headed shark starts attacking the beach. Trapped with minimal weapons they try to fight off the shark, but quickly discover that no one is safe in the water or on land.",9.698,/fS37m9pRBG0QYTeCEtzNBVVVL3H.jpg,DON'T MIX WITH THE SIX!,"horror, action, science fiction, tv movie",The Asylum,United States of America,English,"monster, mutant, shark attack, sequel, shark","Titulo: 6-Headed Shark Attack, Estado: Released, Sinopsis: What is supposed to be a marriage boot camp on a remote island turns into the ultimate test for survival when a 6-headed shark starts attacking the beach. Trapped with minimal weapons they try to fight off the shark, but quickly discover that no one is safe in the water or on land., Generos: horror, action, science fiction, tv movie, Empresas_productoras: The Asylum, Idiomas_hablados: English, palabras_clave: monster, mutant, shark attack, sequel, shark"
84152,Dollman vs. Demonic Toys,5.047,75,Released,1993-10-13,0,64,False,/mnbycTKH1VwGdp3zCD935KCDGqf.jpg,0,,tt0106743,en,Dollman vs. Demonic Toys,"The Demonic Toys are back, so policewoman Judith Grey seeks the help of 12 inch tall Dollman and his 12 inch tall girlfriend, Nurse Ginger. The Toys hole up in an evil deserted toy factory and it's up to Dollman to keep the Toys from summoning the powers of darkness to the Earth.",7.353,/mzd0S30LWCdK5y2pMrObCfGXocN.jpg,All is not well in Toyland.,"horror, thriller, science fiction, action, fantasy",Full Moon Entertainment,United States of America,English,"sequel, killer toys, demonic, evil toys","Titulo: Dollman vs. Demonic Toys, Estado: Released, Sinopsis: The Demonic Toys are back, so policewoman Judith Grey seeks the help of 12 inch tall Dollman and his 12 inch tall girlfriend, Nurse Ginger. The Toys hole up in an evil deserted toy factory and it's up to Dollman to keep the Toys from summoning the powers of darkness to the Earth., Generos: horror, thriller, science fiction, action, fantasy, Empresas_productoras: Full Moon Entertainment, Idiomas_hablados: English, palabras_clave: sequel, killer toys, demonic, evil toys"
39158,Kaw,4.466,74,Released,2007-04-07,0,93,False,/iQFrafT0xVpVMUD38Xa7RTOS6HX.jpg,0,,tt0491005,en,Kaw,"On the last working day of Sheriff Wayne, his small town is attacked by blood thirsty ravens that eat human flesh. Meanwhile his wife Cynthia visits a farm where a Mennonite family lives to say farewell to her friend Gretchen and discloses a dark secret about the origin of the fierce ravens.",8.705,/lYfWo6bS9IX8rMIkTyDb1LN3GmD.jpg,Objects in the mirror may be closer and more terrifying than they appear.,"horror, thriller, science fiction, action","S.V. Scary Films 6, Kaw Productions","Canada, United States of America",English,"farm, small town, fire, sheriff, loss of loved one, deputy sheriff, animal attack, diner, radio, field, bus driver, community, basketball, amish, child in peril, rural area, curse, doctor, corpse, bird attack, exploding car, dead dog, school bus, raven, exploding gasoline station, well, mad cow disease","Titulo: Kaw, Estado: Released, Sinopsis: On the last working day of Sheriff Wayne, his small town is attacked by blood thirsty ravens that eat human flesh. Meanwhile his wife Cynthia visits a farm where a Mennonite family lives to say farewell to her friend Gretchen and discloses a dark secret about the origin of the fierce ravens., Generos: horror, thriller, science fiction, action, Empresas_productoras: S.V. Scary Films 6, Kaw Productions, Idiomas_hablados: English, palabras_clave: farm, small town, fire, sheriff, loss of loved one, deputy sheriff, animal attack, diner, radio, field, bus driver, community, basketball, amish, child in peril, rural area, curse, doctor, corpse, bird attack, exploding car, dead dog, school bus, raven, exploding gasoline station, well, mad cow disease"
40804,Gorgo,5.4,74,Released,1961-02-02,0,78,False,/j0G85RGehOaIIKKG1fgMdLuZoUi.jpg,650000,,tt0054938,en,Gorgo,Greedy sailors capture a giant lizard off the coast of Ireland and sell it to a London circus. Then its mother shows up.,10.728,/fC27POiM5HB08oDxVedPNkGAKUj.jpg,Like nothing you've ever seen before!,"science fiction, action, horror","King Brothers Productions, Metro-Goldwyn-Mayer, British Lion Films","Ireland, United Kingdom, United States of America","English, Irish","island, london, england, circus, giant monster, sunken treasure, prehistoric creature, ireland, rampaging monster, deep-sea dive, property destruction","Titulo: Gorgo, Estado: Released, Sinopsis: Greedy sailors capture a giant lizard off the coast of Ireland and sell it to a London circus. Then its mother shows up., Generos: science fiction, action, horror, Empresas_productoras: King Brothers Productions, Metro-Goldwyn-Mayer, British Lion Films, Idiomas_hablados: English, Irish, palabras_clave: island, london, england, circus, giant monster, sunken treasure, prehistoric creature, ireland, rampaging monster, deep-sea dive, property destruction"
521113,Black Site,5.9,72,Released,2018-08-27,0,87,False,/r18Nxe9YE15XiP6fIh8KPVtzJYf.jpg,0,,tt6964562,en,Black Site,"80's inspired John Carpenteresque Action. A young woman is forced to push past her worst fears and battle to deport an ancient entity back to where it came from. Set inside an underground military base known as The Artemis Black Site, the movie mixes an Escape From New York style survival story with Lovecraftian elements and large scale mythology building.",4.503,/fNOkvUz7mt1PEBVsuV34OCkvShV.jpg,DEPORT ALL GODS.,"action, horror, science fiction",,United Kingdom,English,"mythology, military base, creature, entity, ancient, survive, fears","Titulo: Black Site, Estado: Released, Sinopsis: 80's inspired John Carpenteresque Action. A young woman is forced to push past her worst fears and battle to deport an ancient entity back to where it came from. Set inside an underground military base known as The Artemis Black Site, the movie mixes an Escape From New York style survival story with Lovecraftian elements and large scale mythology building., Generos: action, horror, science fiction, Empresas_productoras: nan, Idiomas_hablados: English, palabras_clave: mythology, military base, creature, entity, ancient, survive, fears"
16634,Alien Trespass,5.104,72,Released,2009-04-03,0,90,False,/cNODQdBJ6FsXMGCDYHeqLsaKhmL.jpg,0,http://www.alientrespass.com,tt1122836,en,Alien Trespass,"In 1957 a fiery object crashes into a mountaintop in the California desert, bringing the threat of disaster to Earth. Out of the flying saucer escapes a murderous creature, the Ghota, bent on destroying all life forms on the planet. A benevolent alien from the spaceship, Urp, inhabits the body of Ted Lewis, an astronomer and with the help of Tammy, a diner waitress, sets out to save mankind.",6.549,/3W6DuB0dp5SSZCvqaJxD25M6Evt.jpg,,"action, adventure, comedy, science fiction, horror",Rangeland Productions,"Canada, United States of America",English,alien abduction,"Titulo: Alien Trespass, Estado: Released, Sinopsis: In 1957 a fiery object crashes into a mountaintop in the California desert, bringing the threat of disaster to Earth. Out of the flying saucer escapes a murderous creature, the Ghota, bent on destroying all life forms on the planet. A benevolent alien from the spaceship, Urp, inhabits the body of Ted Lewis, an astronomer and with the help of Tammy, a diner waitress, sets out to save mankind., Generos: action, adventure, comedy, science fiction, horror, Empresas_productoras: Rangeland Productions, Idiomas_hablados: English, palabras_clave: alien abduction"
315024,Jurassic City,4.583,72,Released,2015-01-09,0,88,False,/8zYSFlklM8n2fxyb0it1lT1P8La.jpg,1500000,,tt2905674,en,Jurassic City,"When a top-secret laboratory is unexpectedly breached, thousands of rampaging raptors are unleashed on Los Angeles! A black-ops unit is mobilized to contain the creatures before they cause city-wide chaos. Simultaneously, a truckload of raptors is rerouted to a nearby prison. Upon their escape, these ferocious flesh-eaters are beyond containment. This is Jurassic judgment night for smoking hot sorority girls, sinister scientists, muscle-bound military and doomed death-row inmates! It's about to get bloody in Jurassic City!",6.108,/vhpcMRNjB1hiKJPS4QPpmV5Mpvn.jpg,Throwing L.A. Back to the Stone Ages,"action, science fiction, horror",Little Dragon Productions,United States of America,English,"tyrannosaurus rex, dinosaur, raptor","Titulo: Jurassic City, Estado: Released, Sinopsis: When a top-secret laboratory is unexpectedly breached, thousands of rampaging raptors are unleashed on Los Angeles! A black-ops unit is mobilized to contain the creatures before they cause city-wide chaos. Simultaneously, a truckload of raptors is rerouted to a nearby prison. Upon their escape, these ferocious flesh-eaters are beyond containment. This is Jurassic judgment night for smoking hot sorority girls, sinister scientists, muscle-bound military and doomed death-row inmates! It's about to get bloody in Jurassic City!, Generos: action, science fiction, horror, Empresas_productoras: Little Dragon Productions, Idiomas_hablados: English, palabras_clave: tyrannosaurus rex, dinosaur, raptor"
